{
  "schema_version": "1.0.0",
  "id": "b443ac8f-3541-5234-8a50-255c5f018d07",
  "workspace_id": "b5ec9caa-2b49-5c91-9dc0-798645c11a37",
  "ownership_type": "system",
  "publisher_type": "system",
  "publisher_name": "Vistora",
  "name": "AI 与科技动态解读",
  "slug": "ai-technology-briefing",
  "description": "基于最新官方和一手来源拆解技术事件、工作原理与行业影响。",
  "visibility": "public_readonly",
  "status": "active",
  "current_version_id": "64d55cde-8a64-537e-8ba7-eb36e9c458d6",
  "forked_from_skill_id": null,
  "created_by": "e1574325-feff-5570-a90f-2261616c9872",
  "created_at": "2026-08-15T00:00:00Z",
  "updated_at": "2026-08-15T00:00:00Z"
}
