{
  "schema_version": "1.0.0",
  "id": "16d8346f-6915-517d-8f52-4518711512ae",
  "workspace_id": "b5ec9caa-2b49-5c91-9dc0-798645c11a37",
  "ownership_type": "system",
  "publisher_type": "system",
  "publisher_name": "Vistora",
  "name": "经典文学书单解说",
  "slug": "classic-literature-booklist",
  "description": "面向公版或已获授权作品的温和荐读与主题解说起点。",
  "visibility": "public_readonly",
  "status": "active",
  "current_version_id": "a74cc517-404a-50e8-a9a2-95d9342f1a61",
  "forked_from_skill_id": null,
  "created_by": "e1574325-feff-5570-a90f-2261616c9872",
  "created_at": "2026-08-15T00:00:00Z",
  "updated_at": "2026-08-15T00:00:00Z"
}
