{
  "schema_version": "1.0.0",
  "id": "cb9f483d-4aa0-525b-8d45-01eaf92997f0",
  "workspace_id": "b5ec9caa-2b49-5c91-9dc0-798645c11a37",
  "ownership_type": "system",
  "publisher_type": "system",
  "publisher_name": "Vistora",
  "name": "通用主题解说",
  "slug": "general-topic-explainer",
  "description": "面向新主题冷启动的安全解说起点，可由用户分叉后调整研究、写作和视觉策略。",
  "visibility": "public_readonly",
  "status": "active",
  "current_version_id": "997e9386-7bd6-5aee-8d8d-ed4030c478bf",
  "forked_from_skill_id": null,
  "created_by": "e1574325-feff-5570-a90f-2261616c9872",
  "created_at": "2026-08-15T00:00:00Z",
  "updated_at": "2026-08-15T00:00:00Z"
}
