{
  "schema_version": "1.0.0",
  "id": "44ea396b-dddd-55a8-8d59-52c96656c195",
  "workspace_id": "b5ec9caa-2b49-5c91-9dc0-798645c11a37",
  "ownership_type": "system",
  "publisher_type": "system",
  "publisher_name": "Vistora",
  "name": "历史人物与制度解读",
  "slug": "historical-figure-explainer",
  "description": "以可核查史料解释人物选择、制度机制与历史后果的故事化解说起点。",
  "visibility": "public_readonly",
  "status": "active",
  "current_version_id": "ddd49010-5050-57cf-a6c8-a90fa0882f87",
  "forked_from_skill_id": null,
  "created_by": "e1574325-feff-5570-a90f-2261616c9872",
  "created_at": "2026-08-15T00:00:00Z",
  "updated_at": "2026-08-15T00:00:00Z"
}
