{
  "schema_version": "1.0.0",
  "id": "20a17524-6736-51ff-97c5-ad504c868742",
  "workspace_id": "b5ec9caa-2b49-5c91-9dc0-798645c11a37",
  "ownership_type": "system",
  "publisher_type": "system",
  "publisher_name": "Vistora",
  "name": "全 AI 影片导演（内部）",
  "slug": "full-ai-video-director",
  "description": "仅供独立 Full-AI 控制面绑定的系统 Skill；不进入标准素材剪辑 Composer。",
  "visibility": "public_readonly",
  "status": "archived",
  "current_version_id": "0979a0d0-4e92-589b-9559-5655b4fbaee0",
  "forked_from_skill_id": null,
  "created_by": "e1574325-feff-5570-a90f-2261616c9872",
  "created_at": "2026-08-23T00:00:00Z",
  "updated_at": "2026-08-24T00:00:00Z"
}
